<?xml version="1.0" encoding="UTF-8"?>
<xsd:schema 
  xmlns:xsd="http://www.w3.org/2001/XMLSchema" 
  xmlns:xlink="http://www.w3.org/1999/xlink" 
  elementFormDefault="qualified">

<xsd:import schemaLocation="xml-2001.xsd" namespace="http://www.w3.org/XML/1998/namespace"/>
<xsd:import schemaLocation="xlinks-2001.xsd" namespace="http://www.w3.org/1999/xlink"/>
 
<xsd:element type="MCRClass" name="mycoreclass"/>

<xsd:complexType name="MCRClass">
 <xsd:sequence>
  <xsd:element maxOccurs="unbounded" minOccurs="1" type="MCRClassLabel"
     name="label"/>
  <xsd:element maxOccurs="1" minOccurs="1" type="MCRClassCatgories" 
     name="categories"/>
 </xsd:sequence>
 <xsd:attribute use="required" type="xsd:string" name="ID"/>
</xsd:complexType>

<xsd:complexType name="MCRClassLabel">
 <xsd:simpleContent>
  <xsd:extension base="xsd:string">
   <xsd:attribute ref="xml:lang"/>
   <xsd:attribute use="required" type="xsd:string" name="text"/>
   <xsd:attribute type="xsd:string" name="description"/>
  </xsd:extension>
 </xsd:simpleContent>
</xsd:complexType>

<xsd:complexType name="MCRClassURL">
<xsd:attribute use="optional" ref="xlink:type"/>
<xsd:attribute ref="xlink:href"/>
<xsd:attribute use="optional" ref="xlink:title"/>
<xsd:attribute use="optional" ref="xlink:label"/>
</xsd:complexType>

<xsd:complexType name="MCRClassCatgories">
 <xsd:sequence>
  <xsd:element maxOccurs="unbounded" minOccurs="1" type="MCRClassCategory"
     name="category"/>
 </xsd:sequence>
</xsd:complexType>

<xsd:complexType name="MCRClassCategory">
 <xsd:sequence>
  <xsd:element maxOccurs="unbounded" minOccurs="1" type="MCRClassLabel"
     name="label"/>
  <xsd:element maxOccurs="1" minOccurs="0" type="MCRClassURL"
     name="url"/>
  <xsd:element maxOccurs="unbounded" minOccurs="0" type="MCRClassCategory"
     name="category"/>
 </xsd:sequence>
 <xsd:attribute use="required" type="xsd:string" name="ID"/>
 <xsd:attribute use="optional" type="xsd:integer" name="counter"/>
</xsd:complexType>

</xsd:schema>

