<?xml version="1.0" encoding="utf-8"?>
<mycoreclass xmlns:xsi="http://www.w3.org/2001/XMLSchema-instance" xsi:noNamespaceSchemaLocation="MCRClassification.xsd" ID="jportal_class_00000051">
    <label xml:lang="de" text="Gattung des rez. Werkes"/>
    <label xml:lang="en" text="Type of reviewed work"/>
    <label xml:lang="pl" text="Gatunek dzieła recenzowanego"/>
    <categories>
        <category ID="00001000">
            <label xml:lang="de" text="Anatomie"/>
            <label xml:lang="en" text="anatomy"/>
            <label xml:lang="pl" text="anatomia"/>
        </category>
        <category ID="00002000">
            <label xml:lang="de" text="Anthropologie"/>
            <label xml:lang="en" text="anthropology"/>
            <label xml:lang="pl" text="antropologia"/>
        </category>
        <category ID="00003000">
            <label xml:lang="de" text="Astronomie"/>
            <label xml:lang="en" text="astronomy"/>
            <label xml:lang="pl" text="astronomia"/>
        </category>
        <category ID="00004000">
            <label xml:lang="de" text="Bauwesen"/>
            <label xml:lang="en" text="construction industry"/>
            <label xml:lang="pl" text="budownictwo"/>
        </category>
        <category ID="00005000">
            <label xml:lang="de" text="Botanik"/>
            <label xml:lang="en" text="botany"/>
            <label xml:lang="pl" text="botanika"/>
        </category>
        <category ID="00006000">
            <label xml:lang="de" text="Chemie"/>
            <label xml:lang="en" text="chemistry"/>
            <label xml:lang="pl" text="chemia"/>
        </category>
        <category ID="00007000">
            <label xml:lang="de" text="Diverses"/>
            <label xml:lang="en" text="miscellaneous material"/>
            <label xml:lang="pl" text="teksty rozmaite"/>
        </category>
        <category ID="00008000">
            <label xml:lang="de" text="Erziehungswissenschaft"/>
            <label xml:lang="en" text="pedagogy"/>
            <label xml:lang="pl" text="pedagogika"/>
        </category>
        <category ID="00009000">
            <label xml:lang="de" text="Forstwesen"/>
            <label xml:lang="en" text="forestry"/>
            <label xml:lang="pl" text="leśnictwo"/>
        </category>
        <category ID="00010000">
            <label xml:lang="de" text="Geographie"/>
            <label xml:lang="en" text="geography"/>
            <label xml:lang="pl" text="geografia"/>
        </category>
        <category ID="00011000">
            <label xml:lang="de" text="Geologie"/>
            <label xml:lang="en" text="geology"/>
            <label xml:lang="pl" text="geologia"/>
        </category>
        <category ID="00012000">
            <label xml:lang="de" text="Gerichtsmedizin"/>
            <label xml:lang="en" text="forensic medicine"/>
            <label xml:lang="pl" text="medycyna sądowa"/>
        </category>
        <category ID="00013000">
            <label xml:lang="de" text="Geschichte"/>
            <label xml:lang="en" text="history"/>
            <label xml:lang="pl" text="historia"/>
        </category>
        <category ID="00014000">
            <label xml:lang="de" text="Kunst"/>
            <label xml:lang="en" text="art"/>
            <label xml:lang="pl" text="sztuka"/>
        </category>
        <category ID="00015000">
            <label xml:lang="de" text="Landeskunde"/>
            <label xml:lang="en" text="regional studies"/>
            <label xml:lang="pl" text="krajoznawstwo"/>
        </category>
        <category ID="00016000">
            <label xml:lang="de" text="Literatur"/>
            <label xml:lang="en" text="literature"/>
            <label xml:lang="pl" text="literatura"/>
        </category>
        <category ID="00017000">
            <label xml:lang="de" text="Mathematik"/>
            <label xml:lang="en" text="mathematics"/>
            <label xml:lang="pl" text="matematyka"/>
        </category>
        <category ID="00018000">
            <label xml:lang="de" text="Medizin"/>
            <label xml:lang="en" text="medicine"/>
            <label xml:lang="pl" text="medycyna"/>
        </category>
        <category ID="00019000">
            <label xml:lang="de" text="Meteorologie"/>
            <label xml:lang="en" text="meteorology"/>
            <label xml:lang="pl" text="meteorologia"/>
        </category>
        <category ID="00020000">
            <label xml:lang="de" text="Mineralogie"/>
            <label xml:lang="en" text="mineralogy"/>
            <label xml:lang="pl" text="mineralogia"/>
        </category>
        <category ID="00021000">
            <label xml:lang="de" text="Naturgeschichte"/>
            <label xml:lang="en" text="natural history"/>
            <label xml:lang="pl" text="historia naturalna"/>
        </category>
        <category ID="00022000">
            <label xml:lang="de" text="Naturkunde"/>
            <label xml:lang="en" text="natural science"/> ????????????
            <label xml:lang="pl" text="przyrodoznawstwo"/>
        </category>
        <category ID="00023000">
            <label xml:lang="de" text="Naturphilosophie"/>
            <label xml:lang="en" text="natural philosophy"/>
            <label xml:lang="pl" text="filozofia przyrody"/>
        </category>
        <category ID="00024000">
            <label xml:lang="de" text="Ökonomie"/>
            <label xml:lang="en" text="economy"/>
            <label xml:lang="pl" text="ekonomia"/>
        </category>
        <category ID="00025000">
            <label xml:lang="de" text="Pharmazie"/>
            <label xml:lang="en" text="pharmacy"/>
            <label xml:lang="pl" text="farmacja"/>
        </category>
        <category ID="00026000">
            <label xml:lang="de" text="Philosophie"/>
            <label xml:lang="en" text="philosophy"/>
            <label xml:lang="pl" text="filozofia"/>
        </category>
        <category ID="00027000">
            <label xml:lang="de" text="Physik"/>
            <label xml:lang="en" text="physics"/>
            <label xml:lang="pl" text="fizyka"/>
        </category>
        <category ID="00028000">
            <label xml:lang="de" text="Physiologie"/>
            <label xml:lang="en" text="physiology"/>
            <label xml:lang="pl" text="fizjologia"/>
        </category>
        <category ID="00029000">
            <label xml:lang="de" text="Rechtswissenschaft"/>
            <label xml:lang="en" text="jurisprudence"/>
            <label xml:lang="pl" text="prawoznawstwo"/>
        </category>
        <category ID="00030000">
            <label xml:lang="de" text="Reisen"/>
            <label xml:lang="en" text="journeys"/>
            <label xml:lang="pl" text="podróże"/>
        </category>
        <category ID="00031000">
            <label xml:lang="de" text="Religion"/>
            <label xml:lang="en" text="religion"/>
            <label xml:lang="pl" text="religia"/>
        </category>
        <category ID="00032000">
            <label xml:lang="de" text="Zoologie"/>
            <label xml:lang="en" text="zoology"/>
            <label xml:lang="pl" text="zoologia"/>
        </category>
    </categories>
</mycoreclass>