<?xml version="1.0" encoding="UTF-8"?>
<mycoreclass xmlns:xsi="http://www.w3.org/2001/XMLSchema-instance" xsi:noNamespaceSchemaLocation="MCRClassification.xsd" ID="jportal_class_00000065">
    <label xml:lang="de" text="Rubrik" description="Rubrik" />
    <label xml:lang="en" text="Rubric" description="Rubric" />
    <categories>
        <category ID="meditation">
            <label xml:lang="de" text="Andachten" />
        </category>
        <category ID="essay">
            <label xml:lang="de" text="AufsÃ¤tze" />
        </category>
        <category ID="report">
            <label xml:lang="de" text="Berichte" />
        </category>
        <category ID="literature">
            <label xml:lang="de" text="Literatur" />
        </category>
    </categories>
</mycoreclass>