<?xml version="1.0" encoding="utf-8"?>
<mycoreclass xmlns:xsi="http://www.w3.org/2001/XMLSchema-instance" xsi:noNamespaceSchemaLocation="MCRClassification.xsd"
	ID="jportal_class_00000080" >
	<label xml:lang="de" text="Ãœberlieferung"/>
	<label xml:lang="en" text="Tradition"/>
	<categories>
		<category ID="altenburg">
			<label xml:lang="de" text="In der Altenburger Sammlung"/>
			<label xml:lang="en" text="In the Altenburg Collection"/>
		</category>
		<category ID="otherLocation">
			<label xml:lang="de" text="Weitere Standorte"/>
			<label xml:lang="en" text="Other location"/>
		</category>
	</categories>
</mycoreclass>