<?xml version="1.0" encoding="utf-8"?>
<mycoreclass xmlns:xsi="http://www.w3.org/2001/XMLSchema-instance" xsi:noNamespaceSchemaLocation="MCRClassification.xsd" ID="jportal_class_00000068">
    <label xml:lang="de" text="Kategorien EZB" description="Kategorien EZB" />
    <categories>
        <category ID="AVSL">
            <label xml:lang="de"
                text="Allgemeine und vergleichende Sprach- und Literaturwissenschaft.Indogermanistik.Aussereuropäische Sprachen und Literaturen." />
        </category>
        <category ID="ALL">
            <label xml:lang="de" text="Allgemeines, Fachübergreifendes" />
        </category>
        <category ID="ANGL">
            <label xml:lang="de" text="Anglistik. Amerikanistik" />
        </category>
        <category ID="ARCH">
            <label xml:lang="de" text="Archäologie" />
        </category>
        <category ID="BAU">
            <label xml:lang="de" text="Architektur, Bauingenieur- und Vermessungswesen" />
        </category>
        <category ID="BILD">
            <label xml:lang="de" text="Bildungsgeschichte" />
        </category>
        <category ID="BIO">
            <label xml:lang="de" text="Biologie" />
        </category>
        <category ID="CHEM">
            <label xml:lang="de" text="Chemie und Pharmazie" />
        </category>
        <category ID="ELECTRO">
            <label xml:lang="de" text="Elektrotechnik,Mess- und Regelungstechnik" />
        </category>
        <category ID="ENERGY">
            <label xml:lang="de" text="Energie, Umweltschutz, Kerntechnik" />
        </category>
        <category ID="ETHNO">
            <label xml:lang="de" text="Ethnologie (Volks- und Völkerkunde)" />
        </category>
        <category ID="GEO">
            <label xml:lang="de" text="Geographie" />
        </category>
        <category ID="GEOWISS">
            <label xml:lang="de" text="Geowissenschaften" />
        </category>
        <category ID="GERMA">
            <label xml:lang="de" text="Germanistik. Niederländische Philologie. Skandinavistik" />
        </category>
        <category ID="GESCH">
            <label xml:lang="de" text="Geschichte" />
        </category>
        <category ID="INFO">
            <label xml:lang="de" text="Informatik" />
        </category>
        <category ID="BUCHWESEN">
            <label xml:lang="de" text="Informations-, Buch- und Bibliothekswesen, Schrift- und Handschriftenkunde" />
        </category>
        <category ID="PHILO">
            <label xml:lang="de" text="Klassische Philologie. Byzantinistik. Mittellateinische und neugriechische Philologie. Neulatein" />
        </category>
        <category ID="KUNST">
            <label xml:lang="de" text="Kunstgeschichte" />
        </category>
        <category ID="LANDWIRT">
            <label xml:lang="de" text="Land- und Forstwirtschaft. Gartenbau. Fischereiwirtschaft. Hauswirtschaft. Ernährung" />
        </category>
        <category ID="MASCHINEN">
            <label xml:lang="de" text="Maschinenwesen, Werkstoffwissenschaften, Fertigungstechnik, Bergbau u. Hüttenwesen, Verkehrstechnik, Feinwerktechnik" />
        </category>
        <category ID="MATHE">
            <label xml:lang="de" text="Mathematik" />
        </category>
        <category ID="MEDIEN">
            <label xml:lang="de" text="Medien- und Kommunikationswissenschaften, Publizistik" />
        </category>
        <category ID="MED">
            <label xml:lang="de" text="Medizin" />
        </category>
        <category ID="MUSIK">
            <label xml:lang="de" text="Musikwissenschaft" />
        </category>
        <category ID="NATUR">
            <label xml:lang="de" text="Naturwissenschaft allgemein" />
        </category>
        <category ID="PÄD">
            <label xml:lang="de" text="Pädagogik" />
        </category>
        <category ID="PHI">
            <label xml:lang="de" text="Philosophie" />
        </category>
        <category ID="PHY">
            <label xml:lang="de" text="Physik" />
        </category>
        <category ID="POLIT">
            <label xml:lang="de" text="Politologie" />
        </category>
        <category ID="PSYCH">
            <label xml:lang="de" text="Psychologie" />
        </category>
        <category ID="RECHT">
            <label xml:lang="de" text="Rechtswissenschaft" />
        </category>
        <category ID="ROMAN">
            <label xml:lang="de" text="Romanistik" />
        </category>
        <category ID="SLAV">
            <label xml:lang="de" text="Slavistik" />
        </category>
        <category ID="SOZIO">
            <label xml:lang="de" text="Soziologie" />
        </category>
        <category ID="SPORT">
            <label xml:lang="de" text="Sport" />
        </category>
        <category ID="TECH">
            <label xml:lang="de" text="Technik allgemein" />
        </category>
        <category ID="THEO">
            <label xml:lang="de" text="Theologie und Religionswissenschaft" />
        </category>
        <category ID="VERF">
            <label xml:lang="de" text="Verfahrenstechnik, Biotechnologie, Lebensmitteltechnologie" />
        </category>
        <category ID="WIWI">
            <label xml:lang="de" text="Wirtschaftswissenschaften" />
        </category>
        <category ID="WIKUNDE">
            <label xml:lang="de" text="Wissenschaftskunde, Forschung, Hochschul-. Museumswesen" />
        </category>
    </categories>
</mycoreclass>