<?xml version="1.0" encoding="utf-8"?>
<mycoreclass xmlns:xsi="http://www.w3.org/2001/XMLSchema-instance" xsi:noNamespaceSchemaLocation="MCRClassification.xsd" ID="jportal_class_00000046">
    <label xml:lang="de" text="Textsorte"/>
    <categories>
        <category ID="00001000">
            <label xml:lang="de" text="Abhandlungen aus andern, vorzüglich fremden Zeitschriften"/>
        </category>
        <category ID="00002000">
            <label xml:lang="de" text="Arbeiten gelehrter Männer und Gesellschaften"/>
        </category>
        <category ID="00003000">
            <label xml:lang="de" text="Auszüge aus Büchern"/>
        </category>
        <category ID="00004000">
            <label xml:lang="de" text="Beförderungen der wissenschaften durch Gönner, Fürsten, Reiche"/>
        </category>
        <category ID="00005000">
            <label xml:lang="de" text="Bemerkungen"/>
        </category>
        <category ID="00006000">
            <label xml:lang="de" text="Beurtheilungen"/>
        </category>
        <category ID="00007000">
            <label xml:lang="de" text="Bücheranzeigen"/>
        </category>
        <category ID="00008000">
            <label xml:lang="de" text="Entdeckungen und Reisen"/>
        </category>
        <category ID="00009000">
            <label xml:lang="de" text="Gelehrte Anfragen und Antworten, Berichtigungen"/>
        </category>
        <category ID="00010000">
            <label xml:lang="de" text="Inhalte von Dissertationen"/>
        </category>
        <category ID="00011000">
            <label xml:lang="de" text="Innhalt von Zeitschriften und Büchern"/>
        </category>
        <category ID="00012000">
            <label xml:lang="de" text="Korrespondenzen"/>
        </category>
        <category ID="00013000">
            <label xml:lang="de" text="Kritk und Antikritik"/>
        </category>
        <category ID="00014000">
            <label xml:lang="de" text="Leben und Weben und Sterben öffentlicher Menschen"/>
        </category>
        <category ID="00015000">
            <label xml:lang="de" text="Literarische Berichte"/>
        </category>
        <category ID="00016000">
            <label xml:lang="de" text="Literarisches Verzeichnis"/>
        </category>
        <category ID="00017000">
            <label xml:lang="de" text="Preisaufgaben"/>
        </category>
        <category ID="00018000">
            <label xml:lang="de" text="Uebersichten der Litteratur, der fremden wie der einheimischen"/>
        </category>
        <category ID="00019000">
            <label xml:lang="de" text="Ursprüngliche Abhandlungen"/>
        </category>
        <category ID="00020000">
            <label xml:lang="de" text="Vorleskataloge"/>
        </category>
        <category ID="00021000">
            <label xml:lang="de" text="Vortragsabdrucke"/>
        </category>
        <category ID="00022000">
            <label xml:lang="de" text="Vortragsinhalte"/>
        </category>
        <category ID="00023000">
            <label xml:lang="de" text="Zusätze und Berichtigungen"/>
        </category>
        <category ID="00024000">
            <label xml:lang="de" text="Zustand wiss. Anstalten, Bibliotheken, Sammlungen, Gärten und Tierhäuser"/>
        </category>
    </categories>
</mycoreclass>