<?xml version="1.0" encoding="utf-8"?>
<mycoreclass xmlns:xsi="http://www.w3.org/2001/XMLSchema-instance" xsi:noNamespaceSchemaLocation="MCRClassification.xsd" ID="jportal_class_00000048">
    <label xml:lang="de" text="Land"/>
    <categories>
        <category ID="00001000">
            <label xml:lang="de" text="Dänemark"/>
        </category>
        <category ID="00002000">
            <label xml:lang="de" text="Deutschland"/>
        </category>
        <category ID="00003000">
            <label xml:lang="de" text="England"/>
        </category>
        <category ID="00004000">
            <label xml:lang="de" text="Frankreich"/>
        </category>
        <category ID="00005000">
            <label xml:lang="de" text="Japan"/>
        </category>
        <category ID="00006000">
            <label xml:lang="de" text="Kolumbien"/>
        </category>
        <category ID="00007000">
            <label xml:lang="de" text="Niederlande"/>
        </category>
        <category ID="00008000">
            <label xml:lang="de" text="Östereich/Ungarn"/>
        </category>
        <category ID="00009000">
            <label xml:lang="de" text="Russland"/>
        </category>
        <category ID="00010000">
            <label xml:lang="de" text="Schottland"/>
        </category>
        <category ID="00011000">
            <label xml:lang="de" text="Schweden"/>
        </category>
        <category ID="00012000">
            <label xml:lang="de" text="Schweiz"/>
        </category>
        <category ID="00013000">
            <label xml:lang="de" text="Teneriffa"/>
        </category>
    </categories>
</mycoreclass>