<?xml version="1.0" encoding="utf-8"?>
<mycoreclass xmlns:xsi="http://www.w3.org/2001/XMLSchema-instance" xsi:noNamespaceSchemaLocation="MCRClassification.xsd"
	ID="jportal_class_00000043">
	<label xml:lang="de" text="PHIL V - Classification for PHIL."/>
	<categories>
		<category ID="00001000">
			<label xml:lang="de" text="Abbildungen"/>
			<label xml:lang="en" text="Illustrations"/>
			<label xml:lang="pl" text="Ilustracje"/>
		</category>
		<category ID="00002000">
			<label xml:lang="de" text="Artikel"/>
			<label xml:lang="en" text="Article"/>
			<label xml:lang="pl" text="ArtykuÅ‚"/>
		</category>
		<category ID="00003000">
			<label xml:lang="de" text="Karten"/>
			<label xml:lang="en" text="Maps"/>
			<label xml:lang="pl" text="Mapy"/>
		</category>
		<category ID="00004000">
			<label xml:lang="de" text="Tabelle"/>
			<label xml:lang="en" text="Chart"/>
			<label xml:lang="pl" text="Tabela"/>
		</category>
		<category ID="00005000">
			<label xml:lang="de" text="Verzeichnis"/>
			<label xml:lang="en" text="Directory"/>
			<label xml:lang="pl" text="Spis"/>
		</category>
	</categories>
</mycoreclass>